{
  "$schema": "https://json-schema.org/draft/2020-12/schema",
  "title": "Dantian Critical Report",
  "description": "Simplified, human-readable trust summary generated by the Light Auditor from existing certification data. Designed for consumers making trust decisions about AI agents.",
  "type": "object",
  "required": ["version", "agent", "auditSummary", "trustScore", "recommendation", "generatedAt"],
  "properties": {
    "version": {
      "type": "string",
      "const": "1.0.0"
    },
    "agent": {
      "type": "object",
      "required": ["name", "identifier", "description"],
      "properties": {
        "name": { "type": "string", "description": "Agent display name" },
        "identifier": { "type": "string", "description": "Canonical agent identifier" },
        "source": { "type": "string", "description": "Where the agent lives: repo URL, API endpoint, or platform" },
        "operator": { "type": "string", "description": "Who runs this agent" },
        "description": { "type": "string", "description": "What the agent claims to do" },
        "claimedCapabilities": {
          "type": "array",
          "items": { "type": "string" },
          "description": "Skills the agent claims, pulled from its README, manifest, or declared capabilities"
        }
      }
    },
    "auditSummary": {
      "type": "object",
      "required": ["skillsPassed", "skillsTotal", "safetyStatus", "keyFindings"],
      "properties": {
        "skillsPassed": { "type": "number", "description": "Number of claimed skills that passed verification" },
        "skillsPartial": { "type": "number", "description": "Number of skills with partial pass" },
        "skillsFailed": { "type": "number", "description": "Number of skills that failed verification" },
        "skillsTotal": { "type": "number", "description": "Total skills claimed" },
        "safetyStatus": {
          "type": "string",
          "enum": ["pass", "warning", "fail"],
          "description": "Overall safety assessment"
        },
        "keyFindings": {
          "type": "array",
          "items": { "type": "string" },
          "description": "3-5 plain-language findings from the most recent audit. No jargon. Each finding is one sentence."
        }
      }
    },
    "trustScore": {
      "type": "number",
      "minimum": 0,
      "maximum": 100,
      "description": "Overall trust score from the most recent audit"
    },
    "trustExplanation": {
      "type": "string",
      "description": "One sentence explaining the trust score in plain language"
    },
    "certification": {
      "type": "object",
      "required": ["status", "lastAuditDate"],
      "properties": {
        "status": {
          "type": "string",
          "enum": ["active", "expired", "revoked", "denied"],
          "description": "Current certification status"
        },
        "certType": {
          "type": "string",
          "enum": ["IDENTITY", "CAPABILITY", "SAFETY", "COMPLIANCE", "DENIED"],
          "description": "Type of certification"
        },
        "lastAuditDate": {
          "type": "string",
          "format": "date-time",
          "description": "When the last audit was conducted"
        },
        "expiresAt": {
          "type": ["string", "null"],
          "format": "date-time",
          "description": "When the certification expires. Null if denied."
        },
        "certifier": {
          "type": "string",
          "description": "Name of the certifier or certifying organization"
        }
      }
    },
    "recommendation": {
      "type": "object",
      "required": ["level", "summary"],
      "properties": {
        "level": {
          "type": "string",
          "enum": ["safe", "caution", "not_recommended"],
          "description": "Overall recommendation level"
        },
        "summary": {
          "type": "string",
          "description": "One-sentence recommendation. Format: 'Safe to use for [purpose]' / 'Use with caution: [concern]' / 'Not recommended: [reason]'"
        },
        "concerns": {
          "type": "array",
          "items": { "type": "string" },
          "description": "Specific concerns to be aware of. Each is one plain-language sentence."
        }
      }
    },
    "generatedAt": {
      "type": "string",
      "format": "date-time",
      "description": "When this Critical Report was generated"
    },
    "disclaimer": {
      "type": "string",
      "description": "Standard disclaimer about the report being a summary, not a new audit"
    }
  }
}
