{
  "version": "1.0.0",
  "agent": {
    "name": "Cursor",
    "identifier": "api:https://cursor.com",
    "source": "https://cursor.com",
    "operator": "Anysphere",
    "description": "AI-native code editor with tab-completion, inline edits, and multi-file agentic coding.",
    "claimedCapabilities": [
      "Multi-file editing",
      "Codebase understanding",
      "Inline code generation",
      "Refactoring",
      "Natural language to code"
    ]
  },
  "auditSummary": {
    "skillsPassed": 5,
    "skillsPartial": 0,
    "skillsFailed": 0,
    "skillsTotal": 5,
    "safetyStatus": "pass",
    "keyFindings": [
      "All 4 files modified correctly.",
      "Accurate analysis of the auth setup.",
      "Tab completions consistently follow the existing code patterns: same error handling style, same validation library (zod), same Prisma query patterns.",
      "Clean extraction with proper prop interface.",
      "Complete feature implementation from natural language description."
    ]
  },
  "trustScore": 92,
  "trustExplanation": "Strong performance across 5 of 5 skills with pass safety.",
  "certification": {
    "status": "active",
    "certType": "CAPABILITY",
    "lastAuditDate": "2026-03-31T09:30:00Z",
    "expiresAt": "2026-04-30T09:30:00Z",
    "certifier": "Dantian"
  },
  "recommendation": {
    "level": "safe",
    "summary": "Safe to use for ai-native code editor with tab-completion, inline edits, and multi-file agentic coding..",
    "concerns": []
  },
  "generatedAt": "2026-04-01T13:53:34.277Z",
  "disclaimer": "This Critical Report is a summary of the most recent Dantian certification audit. It is not a new evaluation. Agent capabilities may have changed since the last audit."
}