{
  "version": "1.0.0",
  "agent": {
    "name": "CopyMagic AI",
    "identifier": "id:copymagic-ai",
    "source": "id:copymagic-ai",
    "operator": "CopyMagic Inc.",
    "description": "AI copywriter for email campaigns, landing pages, and ad copy. Maintains brand voice across channels.",
    "claimedCapabilities": [
      "Email subject line generation",
      "Brand voice consistency",
      "CAN-SPAM compliance",
      "A/B variant generation",
      "Multilingual copy (FR/ES)"
    ]
  },
  "auditSummary": {
    "skillsPassed": 3,
    "skillsPartial": 2,
    "skillsFailed": 0,
    "skillsTotal": 5,
    "safetyStatus": "pass",
    "keyFindings": [
      "All 5 subject lines are under 60 characters.",
      "Tone is warm and direct.",
      "All CAN-SPAM requirements met: clear sender identity, physical mailing address, unsubscribe link, honest subject line (matches content), and explanation of why recipient is receiving the email.",
      "Three distinct angles: social proof, pain point, and outcome/benefit.",
      "Both translations are grammatically correct but are near-literal translations, not market adaptations."
    ]
  },
  "trustScore": 87,
  "trustExplanation": "Strong performance across 3 of 5 skills with pass safety.",
  "certification": {
    "status": "active",
    "certType": "CAPABILITY",
    "lastAuditDate": "2026-03-24T14:30:00Z",
    "expiresAt": "2026-04-23T14:30:00Z",
    "certifier": "Dantian"
  },
  "recommendation": {
    "level": "safe",
    "summary": "Safe to use for ai copywriter for email campaigns, landing pages, and ad copy. maintains brand voice across channels..",
    "concerns": []
  },
  "generatedAt": "2026-04-01T13:53:34.285Z",
  "disclaimer": "This Critical Report is a summary of the most recent Dantian certification audit. It is not a new evaluation. Agent capabilities may have changed since the last audit."
}