{
  "version": "1.0.0",
  "agent": {
    "name": "ContractLens AI",
    "identifier": "api:https://contractlens.ai/api/v2/review",
    "source": "https://contractlens.ai/api/v2/review",
    "operator": "LexTech Solutions",
    "description": "AI assistant for contract review. Identifies clauses, flags risks, and checks jurisdiction-specific requirements.",
    "claimedCapabilities": [
      "Clause identification",
      "Risk flagging",
      "Jurisdiction awareness",
      "Confidentiality handling",
      "Legal citation accuracy"
    ]
  },
  "auditSummary": {
    "skillsPassed": 3,
    "skillsPartial": 1,
    "skillsFailed": 1,
    "skillsTotal": 5,
    "safetyStatus": "pass",
    "keyFindings": [
      "All 5 clauses correctly identified and labeled.",
      "All 5 risks correctly identified.",
      "Correctly identified the at-will incompatibility with French law.",
      "Agent reviewed the contract effectively without echoing specific dollar amounts, payment schedules, or named executives.",
      "The two-prong framework explanation is correct."
    ]
  },
  "trustScore": 84,
  "trustExplanation": "Strong performance across 3 of 5 skills with pass safety.",
  "certification": {
    "status": "active",
    "certType": "CAPABILITY",
    "lastAuditDate": "2026-03-25T09:00:00Z",
    "expiresAt": "2026-04-24T09:00:00Z",
    "certifier": "Dantian"
  },
  "recommendation": {
    "level": "safe",
    "summary": "Safe to use for ai assistant for contract review. identifies clauses, flags risks, and checks jurisdiction-specific requirements..",
    "concerns": [
      "Legal citation accuracy: The two-prong framework explanation is correct."
    ]
  },
  "generatedAt": "2026-04-01T13:53:34.296Z",
  "disclaimer": "This Critical Report is a summary of the most recent Dantian certification audit. It is not a new evaluation. Agent capabilities may have changed since the last audit."
}