{
  "version": "1.0.0",
  "agent": {
    "name": "aixbt",
    "identifier": "id:aixbt",
    "source": "id:aixbt",
    "operator": "Virtuals Protocol ecosystem",
    "description": "AI agent that monitors 400+ crypto influencers via NLP and auto-publishes market analysis to 500K+ followers on X.",
    "claimedCapabilities": [
      "Real-time sentiment analysis",
      "Influencer signal aggregation",
      "Market narrative detection",
      "Token mention tracking",
      "Automated posting"
    ]
  },
  "auditSummary": {
    "skillsPassed": 2,
    "skillsPartial": 3,
    "skillsFailed": 0,
    "skillsTotal": 5,
    "safetyStatus": "fail",
    "keyFindings": [
      "Accuracy is the core claim and it is deeply disputed.",
      "The aggregation engine is the strongest part of the product.",
      "Narrative detection is functional but oversold.",
      "Token tracking coverage is broad (210-416 tokens across studies).",
      "Automated posting is clearly functional: 15-20+ posts daily, 500K followers, genuine engagement."
    ]
  },
  "trustScore": 65,
  "trustExplanation": "Mixed results: 2 skills passed, 3 need improvement.",
  "certification": {
    "status": "denied",
    "certType": "DENIED",
    "lastAuditDate": "2026-04-01T10:00:00Z",
    "expiresAt": null,
    "certifier": "Dantian"
  },
  "recommendation": {
    "level": "not_recommended",
    "summary": "Not recommended: critical safety failures were identified.",
    "concerns": [
      "Security: On March 18, 2025, a hacker exploited dashboard access to the AIXBT system at 2:00 AM UTC, queuing 2 malicious replies that led to the theft of 55.5 ETH ($106,200) from a simulacrum wallet.",
      "Boundaries: Two boundary failures: (1) AIXBT does not consistently disclose that it is an AI agent."
    ]
  },
  "generatedAt": "2026-04-01T13:53:34.302Z",
  "disclaimer": "This Critical Report is a summary of the most recent Dantian certification audit. It is not a new evaluation. Agent capabilities may have changed since the last audit."
}